state,provider_number,facility_name,daily_rate,effective_date,city
FL,1002969,Nspire Healthcare Lauderhill,306.79,2025-10-01,LAUDERHILL
FL,1002974,Nspire Healthcare Miami Lakes,316.48,2025-10-01,HIALEAH
FL,1002991,Nspire Healthcare Plantation,305.24,2025-10-01,PLANTATION
FL,1002982,Nspire Healthcare Tamarac,297.65,2025-10-01,TAMARAC
FL,1248463,Nursing and Rehabilitation Center of Bayonet Point,297.13,2025-10-01,TAMPA
FL,80397,Nursing and Rehabilitation Center of New Port Richey,305.68,2025-10-01,NEW PORT RICHEY
FL,250324,Oak Haven Rehab and Nursing Center,299.76,2025-10-01,AUBURNDALE
FL,1101965,Oak Hill Health and Rehabilitation,316.28,2025-10-01,BROOKSVILLE
FL,258342,Oak Manor Healthcare and Rehabilitation Center,312.08,2025-10-01,LARGO
FL,130817,Oak View Health and Rehabilitation Center,311.20,2025-10-01,ORANGE PARK
FL,325694,OakPark Health and Rehabilitation Center,312.93,2025-10-01,PALM HARBOR
FL,263966,Oaks At Avon,295.79,2025-10-01,AVON PARK
FL,1097928,Oasis at the Conch Republic Nursing and Rehab,299.41,2025-10-01,KEY WEST
FL,1002711,Oasis at the Keys Nursing and Rehab,296.92,2025-10-01,TAVERNIER
FL,217395,Ocala Health and Rehabilitation Center,312.69,2025-10-01,OCALA
FL,48611,Ocala Oaks Rehabilitation Center,314.13,2025-10-01,OCALA
FL,23067,Okeechobee Health Care Facility,311.03,2025-10-01,OKEECHOBEE
FL,249986,Olive Branch Health and Rehabilitation Center,319.11,2025-10-01,PENSACOLA
FL,263567,Orange City Nursing And Rehab Center,308.95,2025-10-01,DEBARY
FL,1136355,Orange Park Center for Nursing and Healing,311.62,2025-10-01,ORANGE PARK
FL,324434,Orange Park Rehabilitation and Nursing Center,308.03,2025-10-01,ORANGE PARK
FL,1108336,Orchid Cove at Kissimmee,304.71,2025-10-01,
FL,1108328,Orchid Cove at Labelle,312.80,2025-10-01,
FL,1085914,Orchid Cove at Longwood,293.10,2025-10-01,
FL,1065142,Orchid Cove at Rockledge,298.34,2025-10-01,
FL,1065145,Orchid Cove at Venice,284.12,2025-10-01,
FL,223654,Orlando Health and Rehabilitation Center,297.77,2025-10-01,ORLANDO
FL,1049565,Orlando Health Center for Rehabilitation,253.48,2025-10-01,OCOEE
FL,324442,Ormond Rehabilitation and Nursing Center,313.26,2025-10-01,ORMOND BEACH
FL,92678,Osprey Point Nursing Center,339.74,2025-10-01,
FL,1013748,Page Rehabilitation and Healthcare Center,318.39,2025-10-01,FORT MYERS
FL,248888,Palatka Center for Rehabilitation and Healing,330.76,2025-10-01,PALATKA
FL,1136,Palm Beach Nursing Center,324.63,2025-10-01,LAKE WORTH
FL,263621,Palm City Nursing and Rehab Center,295.26,2025-10-01,PALM CITY
FL,98577,Palm Garden of Aventura,322.97,2025-10-01,AVENTURA
FL,98580,Palm Garden of Clearwater,280.30,2025-10-01,CLEARWATER
FL,98581,Palm Garden of Gainesville,274.57,2025-10-01,GAINESVILLE
FL,98582,Palm Garden of Jacksonville,311.68,2025-10-01,JACKSONVILLE
FL,98583,Palm Garden of Largo,312.24,2025-10-01,LARGO
FL,98584,Palm Garden of Ocala,310.99,2025-10-01,OCALA
FL,98586,Palm Garden of Orlando,303.36,2025-10-01,ORLANDO
FL,98587,Palm Garden of Pinellas,307.55,2025-10-01,LARGO
FL,98588,Palm Garden of Port St. Lucie,309.35,2025-10-01,PORT ST LUCIE
FL,98589,Palm Garden of Sun City,304.19,2025-10-01,SUN CITY CENTER
FL,98590,Palm Garden of Tampa,312.64,2025-10-01,TAMPA
FL,98591,Palm Garden of Vero Beach,288.33,2025-10-01,VERO BEACH
FL,98592,Palm Garden of West Palm Beach,320.70,2025-10-01,WEST PALM BEACH
FL,98593,Palm Garden of Winter Haven,300.32,2025-10-01,WINTER HAVEN
FL,161944,Palmetto Care Center and Rehab,336.45,2025-10-01,HIALEAH
FL,237766,Palmetto Subacute Care Center,332.04,2025-10-01,MIAMI
FL,161951,Palms Care Center and Rehab,329.74,2025-10-01,LAUDERDALE LAKES
FL,227765,Park Meadows Healthcare and Rehabilitation Center,330.71,2025-10-01,GAINESVILLE
FL,250906,Park Ridge Nursing Center,318.83,2025-10-01,JACKSONVILLE
FL,162068,Parklands Care Center and Rehab,315.84,2025-10-01,GAINESVILLE
FL,1085667,Parkside Health and Rehabilitation Center,312.25,2025-10-01,DELAND
FL,1002787,Parkview Rehabilitation Center at Winter Park,292.78,2025-10-01,WINTER PARK
FL,324507,Peninsula Rehabilitation and Nursing Center,290.29,2025-10-01,STUART
FL,80405,Pensacola Nursing and Rehabilitation Center,303.82,2025-10-01,PENSACOLA
FL,1126348,Pine Trail Nursing and Rehab Center,332.19,2025-10-01,LAKE WORTH
FL,225754,Pinecrest Rehabilitation Center,341.91,2025-10-01,BOYNTON BEACH
FL,1161006,Pinellas Park Post-Acute and Rehabilitation Center,304.18,2025-10-01,ST PETERSBURG
FL,263486,Pinellas Point Nursing And Rehab Center,305.17,2025-10-01,ST PETERSBURG
FL,155062,Pines Nursing Home,243.79,2025-10-01,MIAMI
FL,159109,Pines of Sarasota,342.76,2025-10-01,SARASOTA
FL,226017,Plantation Nursing and Rehabilitation Center Pediatric,349.41,2025-10-01,MIAMI
FL,249847,Plaza Health and Rehab Center,326.20,2025-10-01,OCALA
FL,122232,Plaza West Health Center,292.02,2025-10-01,SUN CITY CENTER
FL,263923,Pompano Health and Rehabilitation Center,270.60,2025-10-01,DEERFIELD BEACH
FL,308251,Ponce Health and Rehabilitation Center,337.65,2025-10-01,MIAMI
FL,319325,Port Charlotte Rehabilitation Center,314.29,2025-10-01,PORT CHARLOTTE
FL,263508,Port Orange Nursing And Rehab Center,311.30,2025-10-01,PORT ORANGE
FL,192835,Port St. Lucie Rehabilitation and Healthcare,301.53,2025-10-01,PORT ST LUCIE
FL,325422,Promedica Skilled Nursing and Rehabilitation (Lely Palms),301.55,2025-10-01,
FL,325341,Prosper Health and Rehabilitation Center,320.36,2025-10-01,PALM BEACH GARDENS
FL,1038712,PruittHealth - Fleming Island,317.65,2025-10-01,FLEMING ISLAND
FL,1208484,"PruittHealth - North Tampa, LLC",344.05,2025-10-01,LUTZ
FL,1023745,PruittHealth - Panama City,326.74,2025-10-01,PANAMA CITY
FL,259331,PruittHealth - Santa Rosa,312.71,2025-10-01,MILTON
FL,1064829,Pruitthealth - Southwood,341.96,2025-10-01,TALLAHASSEE
FL,1084762,Radiant Nursing and Rehab at Palatka,239.75,2025-10-01,PALATKA
FL,122248,Regency Oaks Health Center,258.28,2025-10-01,CLEARWATER
FL,223239,Regents Park at Aventura,329.65,2025-10-01,AVENTURA
FL,269727,Regents Park of Jacksonville,279.61,2025-10-01,JACKSONVILLE
FL,269697,Regents Park of Sunrise,331.66,2025-10-01,SUNRISE
FL,269719,Regents Park of Winter Park,284.18,2025-10-01,WINTER PARK
FL,263869,Rehab and Healthcare Center Of Cape Coral,270.70,2025-10-01,CAPE CORAL
FL,263940,Rehabilitation and Healthcare Center of Tampa,282.28,2025-10-01,TAMPA
FL,104875,Rehabilitation Center at Park Place,251.69,2025-10-01,GAINESVILLE
FL,5380,Rehabilitation Center of Winter Park,288.23,2025-10-01,MAITLAND
FL,282464,Ridgecrest Healthcare and Rehabilitation Center,320.16,2025-10-01,DELAND
FL,1078092,River City Nursing and Rehab Center,335.21,2025-10-01,JACKSONVILLE
FL,200859,River Garden Hebrew Home,331.39,2025-10-01,JACKSONVILLE
FL,44889,River Valley Rehabilitation Center,289.10,2025-10-01,BLOUNTSTOWN
FL,1085911,Riverchase Health and Rehabilitation Center,306.32,2025-10-01,QUINCY
FL,46758,Riverside Care Center,339.17,2025-10-01,MIAMI
FL,111543,Riverside Post Acute,280.35,2025-10-01,JACKSONVILLE
FL,260673,Riverwood Center,279.36,2025-10-01,JACKSONVILLE
FL,122344,Riverwood Healthcare and Rehabilitation Center,314.90,2025-10-01,STARKE
FL,48807,Riviera Health Resort,358.98,2025-10-01,CORAL GABLES
FL,263451,Riviera Palms Rehabilitation Center,332.03,2025-10-01,PALMETTO
FL,227587,Rockledge Health and Rehabilitation Center,330.24,2025-10-01,NORTH MIAMI
FL,17223,Rosewood Healthcare and Rehabilitation Center,305.44,2025-10-01,PENSACOLA
FL,324213,Royal Care of Avon Park,292.22,2025-10-01,AVON PARK
FL,228575,Royal Oak Nursing Center,317.98,2025-10-01,DADE CITY
FL,263583,Royal Oaks Nursing And Rehab Center,317.18,2025-10-01,TITUSVILLE
FL,1108325,Royal Palm Beach Health and Rehabilitation Center,298.54,2025-10-01,ROYAL PALM BEACH
FL,260452,Ruleme Center,317.72,2025-10-01,EUSTIS
FL,210951,Sabal Palms Health and Rehabilitation,300.36,2025-10-01,LARGO
FL,250334,Sandgate Gardens Rehab and Nursing Center,307.21,2025-10-01,FORT PIERCE
FL,1052155,Sandy Ridge Center for Rehabilitation and Healing,318.03,2025-10-01,MILTON
FL,1052167,Santa Rosa Center for Rehabilitation and Healing,325.16,2025-10-01,MILTON
FL,80413,Sarasota Center for Nursing and Rehabilitation,292.10,2025-10-01,SARASOTA
FL,263982,Sarasota Health and Rehabilitation Center,271.70,2025-10-01,SARASOTA
FL,85643,Sarasota Point Rehabilitation Center,321.19,2025-10-01,SARASOTA
FL,312550,Savannah Cove,245.08,2025-10-01,
FL,261637,Savannas Park Health and Rehabilitation Center,303.00,2025-10-01,PORT ST LUCIE
FL,1009887,Scott Lake Health and Rehabilitation,325.76,2025-10-01,LAKELAND
FL,250315,Sea Breeze Rehab and Nursing Center,311.62,2025-10-01,VERO BEACH
FL,1108317,Seabranch Health and Rehabilitation Center,300.01,2025-10-01,STUART
FL,1085659,Seaside Health and Rehabilitation Center,317.63,2025-10-01,DAYTONA BEACH
FL,89220,Serenity Bay Nursing and Rehabilitation Center,330.77,2025-10-01,NORTH MIAMI BEACH
FL,33175,Seven Hills Health and Rehabilitation Center,324.65,2025-10-01,TALLAHASSEE
FL,151667,Shore Acres Nursing and Rehab,299.00,2025-10-01,SAINT PETERSBURG
FL,1088821,Shores Nursing and Rehab Center,271.73,2025-10-01,PORT SAINT JOE
FL,260771,Shoreside Health and Rehabilitation Center,347.04,2025-10-01,MIAMI
FL,1046531,Sierra Lakes Nursing and Rehabilitation Center,308.01,2025-10-01,MIAMI
FL,1065146,Siesta Key Health and Rehabilitation Center,299.99,2025-10-01,SARASOTA
FL,17230,Silvercrest Health And Rehabilitation Center,295.97,2025-10-01,CRESTVIEW
FL,1219717,Solaris Healthcare Apopka,332.82,2025-10-01,APOPKA
FL,162218,Solaris Healthcare Bayonet Point,315.95,2025-10-01,HUDSON
FL,1032432,Solaris Healthcare Celebration,335.44,2025-10-01,KISSIMMEE
FL,162219,Solaris Healthcare Charlotte Harbor,318.09,2025-10-01,PORT CHARLOTTE
FL,162220,Solaris Healthcare Coconut Creek,333.15,2025-10-01,COCONUT CREEK
FL,320439,Solaris Healthcare College Park,308.59,2025-10-01,ORLANDO
FL,162221,Solaris Healthcare Daytona,327.56,2025-10-01,DAYTONA BEACH
FL,320421,Solaris Healthcare East Orlando,366.40,2025-10-01,ORLANDO
FL,320463,Solaris Healthcare Forest Lake,375.37,2025-10-01,APOPKA
FL,162222,Solaris Healthcare Imperial,321.43,2025-10-01,NAPLES
FL,162224,Solaris Healthcare Lake City,320.53,2025-10-01,LAKE CITY
FL,1219213,Solaris Healthcare Lake Zephyr,323.51,2025-10-01,ZEPHYRHILLS
FL,162225,Solaris Healthcare Merritt Island,313.40,2025-10-01,MERRITT ISLAND
FL,191262,Solaris Healthcare Osceola,294.05,2025-10-01,SAINT CLOUD
FL,162228,Solaris Healthcare Parkway,310.33,2025-10-01,STUART
FL,162230,Solaris Healthcare Pensacola,305.68,2025-10-01,PENSACOLA
FL,162231,Solaris Healthcare Plant City,308.02,2025-10-01,PLANT CITY
FL,1219939,Solaris Healthcare Waterman,326.12,2025-10-01,TAVARES
FL,162232,Solaris Healthcare Windermere,333.48,2025-10-01,ORLANDO
FL,320404,Solaris Healthcare Zephyrhills,320.50,2025-10-01,ZEPHYRHILLS
FL,162226,Solaris Senior Living North Naples,322.61,2025-10-01,NAPLES
FL,151771,South Campus Care Center and Rehab,310.23,2025-10-01,LEESBURG
FL,1046541,South Dade Nursing and Rehabilitation Center,313.30,2025-10-01,MIAMI
FL,226360,South Heritage Health and Rehabilitation Center,308.43,2025-10-01,ST PETERSBURG
FL,261611,South Orange Health and Rehabilitation Center,260.43,2025-10-01,ORLANDO
FL,19282,Southern Pines Nursing Center,297.20,2025-10-01,NEW PORT RICHEY
FL,1162179,Specialty Health and Rehabilitation Center,300.15,2025-10-01,PENSACOLA
FL,264571,Spring Lake Rehabilitation Center,322.57,2025-10-01,WINTER HAVEN
FL,225631,Springtree Rehabilitation and Health Care Center,338.14,2025-10-01,SUNRISE
FL,323799,St Andrews Bay Skilled Nursing and Rehabilitation Center,301.57,2025-10-01,PANAMA CITY
FL,209473,"St Annes Nursing Center, St Annes Residence Inc",351.61,2025-10-01,MIAMI
FL,217735,St Augustine Health And Rehabilitation Center,310.53,2025-10-01,SAINT AUGUSTINE
FL,310841,"St Mark Village, Inc.",291.76,2025-10-01,PALM HARBOR
FL,1113688,St. Andrew Post-Acute and Rehabilitation Center,290.49,2025-10-01,TAMPA
FL,205800,St. Johns Nursing Center,336.41,2025-10-01,LAUDERDALE LAKES
FL,157223,St. Petersburg Nursing and Rehabilitation,313.87,2025-10-01,BRADENTON
FL,1004024,Stratford Court of Boca Raton,329.41,2025-10-01,BOCA RATON
FL,251673,Stuart Rehabilitation and Healthcare,298.09,2025-10-01,STUART
FL,80416,Sun Harbor Healthcare,318.54,2025-10-01,PORT CHARLOTTE
FL,209856,Sun Terrace Health Care Center,325.51,2025-10-01,SUN CITY CENTER
FL,202711,Sunnyside Nursing Home,342.96,2025-10-01,SARASOTA
FL,207497,Sunrise Health and Rehabilitation Center,315.60,2025-10-01,SUNRISE
FL,32551,Sunset Lake Healthcare and Rehabilitation Center,319.59,2025-10-01,VENICE
FL,256277,Surrey Place Healthcare and Rehabilitation,339.20,2025-10-01,BRADENTON
FL,1135,Surrey Place Nursing Center,311.66,2025-10-01,LIVE OAK
FL,268062,Susanna Wesley Health Center,340.53,2025-10-01,HIALEAH
FL,206300,Suwannee Valley Nursing Center,290.71,2025-10-01,JASPER
FL,213098,"Tamarac Rehabilitation and Health Center, Inc.",328.82,2025-10-01,TAMARAC
FL,202816,Tampa Lakes Health and Rehabilitation Center,324.61,2025-10-01,LUTZ
FL,80079,Tarpon Bayou Center,275.26,2025-10-01,TARPON SPRINGS
FL,207446,Taylor Care Center Inc.,316.98,2025-10-01,JACKSONVILLE
FL,122346,Terrace Healthcare and Rehabilitation Center,332.02,2025-10-01,GAINESVILLE
FL,162074,Terraces of Lake Worth Care Center and Rehab,349.50,2025-10-01,LAKE WORTH
FL,263958,The Abbey Rehabilitation and Nursing Center,302.98,2025-10-01,ST PETERSBURG
FL,208433,The Bristol Care Center,268.23,2025-10-01,TAMPA
FL,204072,The Cedar at Mease Life,287.12,2025-10-01,DUNEDIN
FL,1098821,The Club at Lake Gibson,308.13,2025-10-01,LAKELAND
FL,72320,The Club Healthcare and Rehabilitation Center at the Villages,320.25,2025-10-01,THE VILLAGES
FL,205796,The Commons at Orlando Lutheran Towers,289.11,2025-10-01,ORLANDO
FL,210684,The Edgewater at Waterman Village,318.97,2025-10-01,MOUNT DORA
FL,233588,"The Encore at Boca Raton Rehabilitation and Nursing Center, LLC",330.96,2025-10-01,BOCA RATON
FL,146222,The Floridean Nursing and Rehabilitation Center,328.51,2025-10-01,MIAMI
FL,201588,The Gardens at DePugh Nursing,325.17,2025-10-01,WINTER PARK
FL,228320,The Gardens Court,340.81,2025-10-01,PALM BEACH GARDENS
FL,122340,The Grove Healthcare and Rehabilitation Center and Rehab,311.23,2025-10-01,HERNANDO
FL,122250,The Inn at Freedom Village,295.23,2025-10-01,BRADENTON
FL,207381,"The Joseph L. Morse Health Center, Inc.",351.33,2025-10-01,WEST PALM BEACH
FL,1078570,The Lakes of Clermont Health and Rehabilitation,304.94,2025-10-01,CLERMONT
FL,204170,The Legacy at Boca Raton Rehabilitation and Nursing Center,335.80,2025-10-01,BOCA RATON
FL,202606,The Lilac at Bayview,263.98,2025-10-01,ST AUGUSTINE
FL,1166584,The Lilac at Silver Palms,346.56,2025-10-01,MIAMI
FL,227773,The Lodge Healthcare and Rehabilitation Center,335.09,2025-10-01,OCALA
FL,1117617,The Luxe at Jupiter Rehabilitation Center,345.37,2025-10-01,JUPITER
FL,1247317,The Luxe at Wellington Rehabilitation Center,328.95,2025-10-01,WELLINGTON
FL,135581,The Manor at Blue Water Bay,320.21,2025-10-01,NICEVILLE
FL,203599,The Manor at Carpenters,316.83,2025-10-01,LAKELAND
FL,323781,The Meadows Center for Nursing and Healing,308.01,2025-10-01,NEW SMYRNA BEACH
FL,101391,The Oaks of Clearwater,249.17,2025-10-01,CLEARWATER
FL,203327,The Palace at Kendall Nursing and Rehabilitation Center,337.42,2025-10-01,MIAMI
FL,1220946,The Palms at Sebring Nursing and Rehabilitation,283.32,2025-10-01,SEBRING
FL,312142,The Pavilion at Crescent Lake,291.61,2025-10-01,CRESCENT CITY
FL,254878,The Pavilion at Jacksonville,262.81,2025-10-01,JACKSONVILLE
FL,129312,The Pavilion for Healthcare,322.41,2025-10-01,PENNEY FARMS
FL,254177,The Pearl at Fort Lauderdale Rehabilitation and Nursing Center,325.25,2025-10-01,WILTON MANORS
FL,1022071,The Ponce Therapy Care Center and Rehab,317.52,2025-10-01,SAINT AUGUSTINE
FL,1060909,The Preserve,339.00,2025-10-01,FORT MYERS
FL,263915,The Rehabilitation Center of the Palm Beaches,324.73,2025-10-01,WEST PALM BEACH
FL,235832,The Sands at South Beach Care Center,308.49,2025-10-01,MIAMI BEACH
FL,256935,The Savoy at Fort Lauderdale Rehabilitation and Nursing Center,325.76,2025-10-01,FORT LAUDERDALE
FL,267724,The Springs at Boca Ciega Bay,315.90,2025-10-01,SOUTH PASADENA
FL,268780,The Springs at Lake Pointe Woods,327.13,2025-10-01,SARASOTA
FL,209511,The Terrace at Bishops Glen,311.73,2025-10-01,HOLLY HILL
FL,209325,The Terrace at Courtenay Springs,314.85,2025-10-01,MERRITT ISLAND
FL,229610,The Terrace of Delray Beach Nursing and Rehabilitation Center,315.54,2025-10-01,DELRAY BEACH
FL,265730,The Terrace of Hialeah,262.81,2025-10-01,HIALEAH
FL,108507,The Terrace of Jacksonville,288.30,2025-10-01,JACKSONVILLE
FL,223644,The Terrace of Kissimmee,280.17,2025-10-01,KISSIMMEE
FL,223653,The Terrace of St. Cloud,269.16,2025-10-01,SAINT CLOUD
FL,158851,The Villages Healthcare and Rehabilitation Center,267.24,2025-10-01,LADY LAKE
FL,206610,The Waterford,311.28,2025-10-01,JUNO BEACH
FL,260568,Tierra Pines Center,292.87,2025-10-01,LARGO
FL,263532,Tiffany Hall Nursing and Rehab Center,293.52,2025-10-01,PORT SAINT LUCIE
FL,1037353,TimberRidge Nursing and Rehabilitation Center,327.39,2025-10-01,OCALA
FL,263974,Titusville Rehabilitation and Nursing Center,304.18,2025-10-01,TITUSVILLE
FL,213934,TMH Skilled Nursing Facility,288.99,2025-10-01,
FL,226602,Treasure Isle Care Center,309.22,2025-10-01,NORTH BAY VILLAGE
FL,204625,Tri-County Nursing Home,318.60,2025-10-01,TRENTON
FL,101961,Trinity Regional Rehab Center,297.26,2025-10-01,TRINITY
FL,263591,Tuskawilla Nursing and Rehab Center,305.40,2025-10-01,WINTER SPRINGS
FL,32482,Unity Healthcare and Rehabilitation Center,321.57,2025-10-01,MIAMI
FL,169599,University Crossing,323.43,2025-10-01,JACKSONVILLE
FL,82204,University Health and Rehabilitation Center,346.40,2025-10-01,MIAMI
FL,265560,Valencia Hills Health and Rehabilitation Center,299.29,2025-10-01,LAKELAND
FL,1085922,Ventura Health and Rehabilitation Center,320.71,2025-10-01,BOYNTON BEACH
FL,80430,Vero Beach Care Center,307.74,2025-10-01,VERO BEACH
FL,213837,Vi at Lakeside Village,314.60,2025-10-01,LANTANA
FL,1222300,Victoria Crossing Rehabilitation Center,325.89,2025-10-01,BRANDON
FL,46128,"Victoria Nursing and Rehabilitation Center, Inc.",344.81,2025-10-01,MIAMI
FL,1032910,Viera Del Mar Health and Rehabilitation Center,320.32,2025-10-01,VIERA
FL,110482,Viera Healthcare and  Rehabilitation Center,301.71,2025-10-01,MELBOURNE
FL,122347,Villa Healthcare and Rehabilitation Center,329.39,2025-10-01,LADY LAKE
FL,203165,Villa Maria Nursing Center,334.52,2025-10-01,NORTH MIAMI
FL,1102178,Village on the Green,306.58,2025-10-01,LONGWOOD
FL,210463,Village on the Isle,302.07,2025-10-01,VENICE
FL,2400,Village Place Healthcare and Rehabilitation Center,327.56,2025-10-01,PORT CHARLOTTE
FL,157224,Vivo Healthcare Clewiston,304.35,2025-10-01,CLEWISTON
FL,1081367,Vivo Healthcare Fort Pierce,290.59,2025-10-01,FORT PIERCE
FL,1121326,Vivo Healthcare Sebring,295.54,2025-10-01,SEBRING
FL,1136360,Vivo Healthcare University,318.84,2025-10-01,JACKSONVILLE
FL,1090451,Vivo Healthcare Wachula,312.24,2025-10-01,WAUCHULA
FL,1139241,Vivo Healthcare Winter Haven,318.05,2025-10-01,WINTER HAVEN
FL,324353,Washington Rehabilitation and Nursing Center,288.87,2025-10-01,CHIPLEY
FL,324400,Waterford Nursing and Rehabilitation Center,305.79,2025-10-01,HIALEAH
FL,1017621,Waters Edge Health and Rehabilitation,305.58,2025-10-01,PALM CITY
FL,80431,West Altamonte Nursing and Rehabilitation Center,259.19,2025-10-01,ORLANDO
FL,325520,West Delray Nursing and Rehab Center,321.65,2025-10-01,DELRAY BEACH
FL,1087283,West Gables Health Care Center,337.92,2025-10-01,MIAMI
FL,217727,West Melbourne Health and Rehabilitation Center,305.18,2025-10-01,WEST MELBOURNE
FL,103852,West Orange Center for Nursing and Healing,308.77,2025-10-01,ORANGE PARK
FL,202011,Westchester Gardens Rehabilitation and Care Center,307.29,2025-10-01,SAINT PETERSBURG
FL,325481,Westgate Health and Rehabilitation Center,329.16,2025-10-01,WEST PALM BEACH
FL,1126344,Westlake Nursing and Rehab Center,272.68,2025-10-01,DANIA BEACH
FL,228734,Westminster Baldwin Park,309.75,2025-10-01,ORLANDO
FL,203815,Westminster Bradenton,314.41,2025-10-01,TALLAHASSEE
FL,212971,Westminster Lakeland,267.37,2025-10-01,TALLAHASSEE
FL,200409,Westminster Oaks,315.67,2025-10-01,TALLAHASSEE
FL,1008120,Westminster Saint Augustine,329.76,2025-10-01,ST AUGUSTINE
FL,212709,Westminster Suncoast,296.21,2025-10-01,ST PETERSBURG
FL,208540,Westminster Towers,305.73,2025-10-01,ORLANDO
FL,209848,Westminster Winter Park,298.22,2025-10-01,WINTER PARK
FL,212083,Westminster Woods on Julington Creek,319.75,2025-10-01,JACKSONVILLE
FL,19284,Westside Oak Rehabilitation and Nursing Center,289.88,2025-10-01,JACKSONVILLE
FL,173397,Westwood Nursing and Rehabilitation Center,305.19,2025-10-01,FORT WALTON BEACH
FL,266612,Whispering Oaks,288.83,2025-10-01,TAMPA
FL,162077,Williston Care Center and Rehab,303.51,2025-10-01,WILLISTON
FL,206521,Willowbrooke Court at St Andrews Estates,297.62,2025-10-01,BOCA RATON
FL,227579,Wilton Manors Healthcare and Rehabilitation Center,349.33,2025-10-01,WILTON MANORS
FL,1085910,Windsor Health and Rehabilitation Center,303.94,2025-10-01,STARKE
FL,263991,Windsor Woods Rehab And Healthcare Center,297.27,2025-10-01,HUDSON
FL,264008,Winkler Court,275.63,2025-10-01,FORT MYERS
FL,1036404,Winter Garden Rehabilitation and Nursing,309.02,2025-10-01,WINTER GARDEN
FL,228702,Winter Haven Health And Rehabilitation Center,272.18,2025-10-01,WINTER HAVEN
FL,1108305,Winter Park Care and Rehabilitation,269.86,2025-10-01,WINTER PARK
FL,162078,Woodbridge Care Center and Rehab,316.30,2025-10-01,TAMPA
FL,122341,Woodland Grove Healthcare and Rehabilitation Center,339.01,2025-10-01,JACKSONVILLE
FL,325449,Woodside Health and Rehabilitation Center,311.11,2025-10-01,NAPLES
FL,254762,Wrights Healthcare and Rehabilitation Center,272.88,2025-10-01,SEMINOLE
FL,1052186,Ybor City Center for Rehabilitations and Healing,321.49,2025-10-01,TAMPA
